{
  "schemaVersion": 1,
  "id": "roadmap:awesome-llm-apps-roadmap",
  "slug": "awesome-llm-apps-roadmap",
  "title": "AI-Native Knowledge Garden Roadmap",
  "summary": "A product roadmap for turning the knowledge garden into an agent-auditable publishing system, informed by runnable examples in Shubhamsaboo/awesome-llm-apps.",
  "status": "published",
  "updatedAt": "2026-06-17",
  "sourceRepo": {
    "name": "Shubhamsaboo/awesome-llm-apps",
    "url": "https://github.com/Shubhamsaboo/awesome-llm-apps",
    "commit": "ca3a3d3",
    "commitDate": "2026-06-14",
    "reviewedAt": "2026-06-17"
  },
  "thesis": "The knowledge garden should evolve from static article plus agent packet into a validated research object pipeline: source intake, claim verification, deterministic artifacts, reviewer gates, and optional agent-native authoring tools.",
  "priorityCounts": {
    "P0": 7,
    "P1": 7,
    "P2": 2
  },
  "phases": [
    {
      "id": "phase-0",
      "name": "Make Evidence Packets Real",
      "horizon": "next foundation pass",
      "outcome": "Every public claim has structured support, counterevidence, source quality, and validation rules that fail weak packets before publish.",
      "ideaIds": [
        "idea-claim-evidence-packet-v2",
        "idea-evidence-ci-diagnostics",
        "idea-claim-verification-workbench",
        "idea-ux-governance-checks"
      ]
    },
    {
      "id": "phase-1",
      "name": "Build The Authoring Workspace",
      "horizon": "near-term author workflow",
      "outcome": "Research plans, source captures, article drafts, artifact diffs, and reviewer results become durable files rather than disappearing in chat history.",
      "ideaIds": [
        "idea-research-workspace-builder",
        "idea-artifact-widget-catalog",
        "idea-trust-gated-publishing-pipeline"
      ]
    },
    {
      "id": "phase-2",
      "name": "Expand Intake And Retrieval",
      "horizon": "after first public launch",
      "outcome": "The garden can scout new sources, import papers and URLs, suggest graph relations, and expose tool-safe retrieval paths for agents.",
      "ideaIds": [
        "idea-always-on-source-ledger-scout",
        "idea-provenance-graph-v2",
        "idea-source-ledger-importer",
        "idea-corrective-research-assistant",
        "idea-garden-mcp-router"
      ]
    },
    {
      "id": "phase-3",
      "name": "Optimize Agent Consumption",
      "horizon": "later workflow layer",
      "outcome": "Agents can consume compact packets, inspect evidence interactively, and regression-test briefs without turning the public site into a runtime app.",
      "ideaIds": [
        "idea-compact-agent-feeds",
        "idea-claim-evidence-canvas",
        "idea-agent-brief-evaluation-harness",
        "idea-agent-native-packet-inspector"
      ]
    }
  ],
  "ideas": [
    {
      "id": "idea-claim-evidence-packet-v2",
      "title": "Claim Evidence Packet v2",
      "priority": "P0",
      "category": "evidence",
      "sourcePaths": [
        "rag_tutorials/knowledge_graph_rag_citations/README.md",
        "rag_tutorials/multimodal_agentic_rag/README.md",
        "advanced_ai_agents/single_agent_apps/earnings_call_analyst_agent/schemas.py"
      ],
      "pattern": "Retrieval results and citation UI are backed by typed objects that carry source, evidence, confidence, and provenance.",
      "gardenMapping": "Extend claim records beyond source IDs into evidence snippets, source locations, support type, counterevidence, extraction metadata, and reviewer status.",
      "firstImplementation": "Add an evidencePackets array to artifact.json and render one compact evidence card per claim in the article audit section.",
      "risks": [
        "Citation IDs can become theater if snippets do not actually support the claim.",
        "Evidence snippets must be short and attributable without copying long copyrighted passages."
      ]
    },
    {
      "id": "idea-evidence-ci-diagnostics",
      "title": "Evidence CI And RAG Diagnostics",
      "priority": "P0",
      "category": "governance",
      "sourcePaths": [
        "rag_tutorials/rag_failure_diagnostics_clinic/README.md",
        "rag_tutorials/corrective_rag/README.md",
        "rag_tutorials/contextualai_rag_agent/README.md"
      ],
      "pattern": "A small failure taxonomy, relevance grading, and answer evaluation can catch structural problems earlier than prompt tweaks.",
      "gardenMapping": "Fail CI for orphan claims, empty evidence, missing counterevidence, stale source dates, low source diversity, and dangling graph edges.",
      "firstImplementation": "Add deterministic validators first, then allow optional LLM audit reports as non-blocking artifacts until the taxonomy is stable.",
      "risks": [
        "LLM audits can be noisy and should not replace deterministic schema checks.",
        "External link checks can be flaky and should use retries or scheduled mode."
      ]
    },
    {
      "id": "idea-claim-verification-workbench",
      "title": "Claim Verification Workbench",
      "priority": "P0",
      "category": "evidence",
      "sourcePaths": [
        "awesome_agent_skills/fact-checker/SKILL.md",
        "awesome_agent_skills/deep-research/SKILL.md",
        "awesome_agent_skills/academic-researcher/SKILL.md",
        "advanced_ai_agents/single_agent_apps/ai_deep_research_agent/README.md"
      ],
      "pattern": "Research agents extract claims, define required evidence, rate source quality, and synthesize findings with citations.",
      "gardenMapping": "Create an author-side workflow that walks each claim through required evidence, source quality, gap notes, counterclaims, and last-checked date.",
      "firstImplementation": "Add verification fields to claim objects and a report command that lists claims by verified, needs evidence, contested, or stale.",
      "risks": [
        "Source quality ratings need human review for contested or interpretive claims.",
        "The workbench should help authors decide; it should not silently approve claims."
      ]
    },
    {
      "id": "idea-ux-governance-checks",
      "title": "UX Governance Checks",
      "priority": "P0",
      "category": "interface",
      "sourcePaths": [
        "awesome_agent_skills/ux-designer/SKILL.md"
      ],
      "pattern": "UX review can be encoded as reusable criteria for accessibility, hierarchy, interaction, and information architecture.",
      "gardenMapping": "Make reading quality part of the publishing gate: mobile flow, keyboard access, source ledger scanability, claim marker clarity, and dark mode.",
      "firstImplementation": "Add a docs checklist and optional Playwright assertions for no horizontal overflow, collapsed mobile audit rail, visible focus, and route availability.",
      "risks": [
        "Visual polish can drift into dashboard creep if every data point becomes a widget.",
        "Automated checks cannot judge whether the article actually reads well."
      ]
    },
    {
      "id": "idea-research-workspace-builder",
      "title": "Research Workspace Builder",
      "priority": "P0",
      "category": "authoring",
      "sourcePaths": [
        "generative_ui_agents/ai-deep-research-agent/README.md",
        "advanced_ai_agents/single_agent_apps/research_agent_gemini_interaction_api/README.md"
      ],
      "pattern": "A sidecar workspace captures plans, todos, files, research runs, and synthesis outputs as the agent works.",
      "gardenMapping": "Create a local authoring mode where research plans, source captures, claim packets, and final article artifacts are durable files in the repo.",
      "firstImplementation": "Start with CLI scaffolding for an article workspace before adding any live UI.",
      "risks": [
        "A runtime authoring app is larger than the static site and should remain local until the workflow proves itself.",
        "Chat history should not become the source of truth."
      ]
    },
    {
      "id": "idea-artifact-widget-catalog",
      "title": "Artifact Widget Catalog",
      "priority": "P0",
      "category": "interface",
      "sourcePaths": [
        "generative_ui_agents/generative-ui-starter-project/README.md",
        "generative_ui_agents/ai-shadcn-component-generator/README.md"
      ],
      "pattern": "Generative UI works best when agents choose from bounded, typed components rather than arbitrary executable UI.",
      "gardenMapping": "Define approved static components for ClaimCard, SourceLedger, MaturityBadge, StemGraph, AgentPacketPreview, and RoadmapItem.",
      "firstImplementation": "Document component contracts and render the roadmap page from a schema-validated JSON artifact.",
      "risks": [
        "Unbounded generated UI is a security and maintenance risk for a public static site.",
        "Widget schemas must stay aligned with article and roadmap schemas."
      ]
    },
    {
      "id": "idea-trust-gated-publishing-pipeline",
      "title": "Trust-Gated Publishing Pipeline",
      "priority": "P0",
      "category": "governance",
      "sourcePaths": [
        "advanced_ai_agents/multi_agent_apps/trust_gated_agent_team/README.md",
        "advanced_ai_agents/multi_agent_apps/multi_agent_trust_layer/README.md"
      ],
      "pattern": "Agent participation is gated by trust checks, scoped roles, and hash-chained audit records.",
      "gardenMapping": "Record agent roles, inputs, output hashes, review status, policy scope, and human approval before an article can move to published.",
      "firstImplementation": "Add optional provenance.json per article and make published status require a humanReview block plus generated artifact diff.",
      "risks": [
        "Hash chains alone are not a complete security model without signing or trusted timestamps.",
        "Sensitive prompts and private notes should be hashed or summarized, not published."
      ]
    },
    {
      "id": "idea-always-on-source-ledger-scout",